{
  "id": "product-scope-expansion",
  "version": "1.0",
  "name": "Product Scope Expansion",
  "description": "Broaden PersonaKit's product goals while authoring pack content.",
  "providedBy": [
    "external-agent"
  ],
  "capabilities": [
    "edit-files"
  ],
  "risk": {
    "level": "high",
    "requiresHumanReview": true,
    "notes": [
      "Pack authoring should not change PersonaKit's product scope."
    ]
  },
  "notes": [
    "Included as a forbidden skill example."
  ]
}
